<?xml version="1.0" encoding="UTF-8"?>
<job_scheduler schema_version="29" lowest_compatible_version="28" xmlns:xsi="http://www.w3.org/2001/XMLSchema-instance" xsi:schemaLocation=". jobschedulersettings.xsd">
	<options>
		<Verbose>true</Verbose>
	</options>
	<options controller="local service">
		<TaskRootDataPath>$appdatadir\..\awr_job_data</TaskRootDataPath>
		<TokensOnly>true</TokensOnly>
		<TokenizeCommandPaths>true</TokenizeCommandPaths>
		<Verbose>true</Verbose>
	</options>
	<tasks controller="local service">
		<token>
			<Name>AXIEM</Name>
			<Path>$installdir_x64\$Name.exe</Path>
			<Path>$installdir_win32\$Name.exe</Path>
			<LoadPaths>
				<RootRegKey>HKLM\SOFTWARE\AWR\$regex[v[1-9][0-9]]\$regex[[0-9]{2}\.(0|[0-9]{2})\.[0-9]{4,}\.[0-9]+]</RootRegKey>
				<Path version="$regkey[$RootRegKey]">$regval[$RootRegKey\Directory]\$Name.exe</Path>
				<Path version="$regkey[$RootRegKey]">$regval[$RootRegKey\Directory]\win32\$Name.exe</Path>
			</LoadPaths>
		</token>
		<token>
			<Name>MWOffice</Name>
			<Path>$installdir_x64\$Name.exe</Path>
			<Path>$installdir_win32\$Name.exe</Path>
			<LoadPaths>
				<RootRegKey>HKLM\SOFTWARE\AWR\$regex[v[1-9][0-9]]\$regex[[0-9]{2}\.(0|[0-9]{2})\.[0-9]{4,}\.[0-9]+]</RootRegKey>
				<Path version="$regkey[$RootRegKey]">$regval[$RootRegKey\Directory]\$Name.exe</Path>
				<Path version="$regkey[$RootRegKey]">$regval[$RootRegKey\Directory]\win32\$Name.exe</Path>
			</LoadPaths>
		</token>
		<token>
			<Name>AWR_EMS2Proxy</Name>
			<Path>$installdir_x64\$Name.exe</Path>
			<Path>$installdir_win32\$Name.exe</Path>
			<LoadPaths>
				<RootRegKey>HKLM\SOFTWARE\AWR\$regex[v[1-9][0-9]]\$regex[[0-9]{2}\.(0|[0-9]{2})\.[0-9]{4,}\.[0-9]+]</RootRegKey>
				<Path version="$regkey[$RootRegKey]">$regval[$RootRegKey\Directory]\$Name.exe</Path>
				<Path version="$regkey[$RootRegKey]">$regval[$RootRegKey\Directory]\win32\$Name.exe</Path>
			</LoadPaths>
		</token>
		<token>
			<Name>analyst</Name>
			<Path>$installdir_x64\analyst\$Name.exe</Path>
			<LoadPaths>
				<RootRegKey>HKLM\SOFTWARE\AWR\$regex[v[1-9][0-9]]\$regex[[0-9]{2}\.(0|[0-9]{2})\.[0-9]{4,}\.[0-9]+]</RootRegKey>
				<Path version="$regkey[$RootRegKey]">$regval[$RootRegKey\Directory]\analyst\$Name.exe</Path>
			</LoadPaths>
		</token>
		<token>
			<Name>analyst</Name>
			<LoadPaths>
				<RootRegKey>HKLM\SOFTWARE\AWR\Analyst64\$regex[((1[1-9])|([2-9][0-9]))\.[0-9]{2}\.[0-9]{4,}\.[0-9]+]</RootRegKey>
				<Path version="$regval[$RootRegKey\MWOVersion]">$regval[$RootRegKey\Directory]\$Name.exe</Path>
			</LoadPaths>
		</token>
		<token>
			<Name>geopr</Name>
			<Path>$installdir_x64\analyst\$Name.exe</Path>
			<LoadPaths>
				<RootRegKey>HKLM\SOFTWARE\AWR\$regex[v[1-9][0-9]]\$regex[[0-9]{2}\.(0|[0-9]{2})\.[0-9]{4,}\.[0-9]+]</RootRegKey>
				<Path version="$regkey[$RootRegKey]">$regval[$RootRegKey\Directory]\analyst\$Name.exe</Path>
			</LoadPaths>
		</token>
		<token>
			<Name>geopr</Name>
			<LoadPaths>
				<RootRegKey>HKLM\SOFTWARE\AWR\Analyst64\$regex[((1[1-9])|([2-9][0-9]))\.[0-9]{2}\.[0-9]{4,}\.[0-9]+]</RootRegKey>
				<Path version="$regval[$RootRegKey\MWOVersion]">$regval[$RootRegKey\Directory]\$Name.exe</Path>
			</LoadPaths>
		</token>
		<token>
			<Name>grsim</Name>
			<Path>$installdir_x64\analyst\$Name.exe</Path>
			<LoadPaths>
				<RootRegKey>HKLM\SOFTWARE\AWR\$regex[v[1-9][0-9]]\$regex[[0-9]{2}\.(0|[0-9]{2})\.[0-9]{4,}\.[0-9]+]</RootRegKey>
				<Path version="$regkey[$RootRegKey]">$regval[$RootRegKey\Directory]\analyst\$Name.exe</Path>
			</LoadPaths>
		</token>
		<token>
			<Name>grsim</Name>
			<LoadPaths>
				<RootRegKey>HKLM\SOFTWARE\AWR\Analyst64\$regex[((1[1-9])|([2-9][0-9]))\.[0-9]{2}\.[0-9]{4,}\.[0-9]+]</RootRegKey>
				<Path version="$regval[$RootRegKey\MWOVersion]">$regval[$RootRegKey\Directory]\$Name.exe</Path>
			</LoadPaths>
		</token>
		<token>
			<Name>mpiexec</Name>
			<Path>$installdir_x64\analyst\$Name.exe</Path>
			<LoadPaths>
				<RootRegKey>HKLM\SOFTWARE\AWR\$regex[v[1-9][0-9]]\$regex[[0-9]{2}\.(0|[0-9]{2})\.[0-9]{4,}\.[0-9]+]</RootRegKey>
				<Path version="$regkey[$RootRegKey]">$regval[$RootRegKey\Directory]\analyst\$Name.exe</Path>
			</LoadPaths>
		</token>
		<token>
			<Name>mpiexec</Name>
			<LoadPaths>
				<RootRegKey>HKLM\SOFTWARE\AWR\Analyst64\$regex[((1[1-9])|([2-9][0-9]))\.[0-9]{2}\.[0-9]{4,}\.[0-9]+]</RootRegKey>
				<Path version="$regval[$RootRegKey\MWOVersion]">$regval[$RootRegKey\Directory]\$Name.exe</Path>
			</LoadPaths>
		</token>
		<token>
			<Name>AWRBatchRun</Name>
			<LoadPaths>
				<RootRegKey>HKLM\SOFTWARE\Ansoft\ElectronicsDesktop\$regex[[0-9]{4,}\.[0-9]+]</RootRegKey>
				<Path>$regval[$RootRegKey\Desktop\InstallationDirectory]\ElectronicsDesktop\syslib\Toolkits\Lib\AWRIntegration\AWRBatchRun.bat</Path>
			</LoadPaths>
		</token>
	</tasks>
</job_scheduler>
